{
	"name":"tan",
	"type":"function",
	"syntax":"tan(number)",
	"returns":"numeric",
	"related":["acos","asin","atn","cos","exp","log","log10","sin"],
	"description":" Calculates the tangent of an angle that is entered in radians.",
	"params": [
		{"name":"number","description":"Angle, in radians, for which to calculate the tangent","required":true,"default":"","type":"numeric","values":[]}
	],
	"engines": {
		"coldfusion": {"minimum_version":"", "notes":"", "docs":"https://helpx.adobe.com/coldfusion/cfml-reference/coldfusion-functions/functions-t-z/tan.html"},
		"lucee": {"minimum_version":"", "notes":"", "docs":"https://docs.lucee.org/reference/functions/tan.html"},
		"railo": {"minimum_version":"", "notes":"", "docs":"http://railodocs.org/index.cfm/function/tan"},
		"openbd": {"minimum_version":"", "notes":"", "docs":"http://openbd.org/manual/?/function/tan"},
		"boxlang": {"minimum_version":"1.0.0", "notes":"", "docs":"https://boxlang.ortusbooks.com/boxlang-language/reference/built-in-functions/math/tan"},
		"rustcfml": {"minimum_version": ""}
	},
	"links": [

	],
	"examples": [
		{
			"title":"Tangent of 0.3",
			"description":"",
			"code":"tan(0.3)",
			"result":"0.30933624961",
			"runnable":true
		}
	]

}
