{
	"name":"structSetMetadata",
	"type":"function",
	"syntax":"structSetMetadata(inputStruct, metaStruct)",
	"returns":"void",
	"related":["arraySetMetadata","arrayGetMetadata","structGetMetadata"],
	"member":"inputStruct.setMetadata(metaStruct)",
	"description":"Sets metadata for a key in a struct. When you want to SerializeJSON, the key and the value will be display as you defined in the metadata.",
	"params": [
		{"name":"inputStruct","description":"The struct in which you want to add the metadata.","required":true,"default":"","type":"struct","values":[]},
		{"name":"metaStruct","description":"The metadata struct you want to add.","required":true,"default":"","type":"struct","values":[]}
	],
	"engines": {
		"coldfusion": {"minimum_version":"2016.0.2", "notes":"", "docs":"https://helpx.adobe.com/coldfusion/cfml-reference/coldfusion-functions/functions-s/structsetmetadata.html"},
		"rustcfml": {"minimum_version": "", "notes": "Throws (Adobe-CF-only, not in Lucee either)."}
	},
    	"links": [],
    	"examples": [
		{
			"title":"Add metadata to a struct",
			"description":"Add metadata to a struct and serialize to a json.\nIt is changing the keyname and convert a string (\"20\") to a number.",
			"code":"testStruct = structNew(\"ordered\");\ntestStruct.testdata = \"example\";\ntestStruct.testdata2 = \"20\";\nmetadata = {\n    testdata: {type: \"string\", name: \"td1\" },\n    testdata2: {type: \"numeric\", name: \"td2\" }\n};\nStructSetMetadata(testStruct,metadata);\nwriteoutput(SerializeJSON(testStruct));",
			"result":"{\"td1\":\"example\", \"td2\":20.0}",
			"runnable": true
		},
		{
			"title":"Add metadata to a struct as a member function",
			"description":"Add metadata to a struct and serialize to a json.\nIt is changing the keyname and convert a string (\"20\") to a number.",
			"code":"testStruct = structNew(\"ordered\");\ntestStruct.testdata = \"example\";\ntestStruct.testdata2 = \"20\";\nmetadata = {\n    testdata: {type: \"string\", name: \"td1\" },\n    testdata2: {type: \"numeric\", name: \"td2\" }\n};\ntestStruct.setMetadata(metadata);\nwriteoutput(SerializeJSON(testStruct));",
			"result":"{\"td1\":\"example\", \"td2\":20.0}",
			"runnable": true
		}
	]
}
