{
	"name":"isValid",
	"type":"function",
	"syntax":"isValid(type, value, min, max, pattern)",
	"returns":"boolean",
	"related":["isarray", "issimplevalue","isnumeric","isboolean","isdate","cfparam"],
	"description":"Tests whether a value meets a validation or data type rule.",
	"params": [
		{"name":"type","description":"The valid format for the data.","required":true,"default":"","type":"string","values":["any", "array", "binary", "boolean", "component", "creditcard", "date", "email", "eurodate", "float", "function", "guid", "integer", "numeric", "query", "range", "regex", "regular_expression", "social_security_number", "ssn", "string", "struct", "telephone", "time", "url", "usdate", "uuid", "variablename", "xml", "zipcode"]},
		{"name":"value","description":"The value to test.","required":true,"default":"","type":"any","values":[]},
		{"name":"min","description":"The minimum valid value; used only for range validation.","required":false,"default":"","type":"numeric","values":[]},
		{"name":"max","description":"The maximum valid value; used only for range validation.","required":false,"default":"","type":"numeric","values":[]},
		{"name":"pattern","description":"A regular expression that the parameter must match;\n used only for regex or regular_expression validation.","required":false,"default":"","type":"string","values":[]}
	],
	"engines": {
		"coldfusion": {"minimum_version":"7", "notes":"CF8+ - added component as a type option.\nCF11+ - no longer allows currency symbols at the start and commas inside a number. Can be reverted to legacy mode by setting this.strictNumberValidation = false in Application.cfc", "docs":"https://helpx.adobe.com/coldfusion/cfml-reference/coldfusion-functions/functions-in-k/isvalid.html"},
		"lucee": {"minimum_version":"", "notes":"", "docs":"https://docs.lucee.org/reference/functions/isvalid.html"},
		"railo": {"minimum_version":"", "notes":"", "docs":"http://railodocs.org/index.cfm/function/isvalid"},
		"openbd": {"minimum_version":"", "notes":"", "docs":"http://openbd.org/manual/?/function/isvalid"},
		"boxlang": {"minimum_version":"1.0.0", "notes":"", "docs":"https://boxlang.ortusbooks.com/boxlang-language/reference/built-in-functions/decision/isvalid"},
		"rustcfml": {"minimum_version": ""}
	},
	"links": [

	],
	"examples": [
		{
			"title":"Check to see if a 235 is an integer",
			"description":"Use the isValid function with integer as the type.",
			"code":"isValid(\"integer\", 235)",
			"result":"true"
		},
		{
			"title":"Validate an Email Address",
			"description":"Use the isValid function with email as the type.",
			"code":"isValid(\"email\", \"user@example.com\")",
			"result":"true"
		}
	]

}
