{
	"name":"fileReadBinary",
	"type":"function",
	"syntax":"fileReadBinary(filePath)",
	"returns":"binary",
	"related":["fileRead","fileReadLine"],
	"description":"Reads an on-disk or in-memory binary file (such as an executable or image file) on the server, into a binary object",
	"params": [
		{"name":"filePath","description":"Absolute path to the file.","required":true,"default":"","type":"string","values":[]}
	],
	"engines": {
		"coldfusion": {"minimum_version":"8", "notes":"", "docs":"https://helpx.adobe.com/coldfusion/cfml-reference/coldfusion-functions/functions-e-g/filereadbinary.html"},
		"lucee": {"minimum_version":"", "notes":"", "docs":"https://docs.lucee.org/reference/functions/filereadbinary.html"},
		"railo": {"minimum_version":"", "notes":"", "docs":"http://railodocs.org/index.cfm/function/filereadbinary"},
		"openbd": {"minimum_version":"", "notes":"", "docs":"http://openbd.org/manual/?/function/filereadbinary"},
		"boxlang": {"minimum_version":"1.0.0", "notes":"", "docs":"https://boxlang.ortusbooks.com/boxlang-language/reference/built-in-functions/io/filereadbinary"},
		"rustcfml": {"minimum_version": ""}
	},
	"links": [],
	"examples": [
		{
			"title": "Read a file into a binary object",
			"description": "Uses expandPath to grab a file in current directory.",
			"code": "binaryContent = fileReadBinary(expandPath('./file.pdf'));",
			"result": "",
			"runnable": false
		}
	]
}
