{
	"name":"decodeFromURL",
	"type":"function",
	"syntax":"decodeFromURL(string);",
	"returns":"string",
	"related":["encodeForURL"],
	"description":" Decodes an encoded HTML URL string.",
	"params": [
		{"name":"string","description":"The encoded URL string to decode..","required":true,"default":"","type":"string","values":[]}
	],
	"engines": {
		"coldfusion": {"minimum_version":"10", "notes":"", "docs":"https://helpx.adobe.com/coldfusion/cfml-reference/coldfusion-functions/functions-c-d/DecodeFromURL.html"},
		"lucee": {"minimum_version":"", "notes":"", "docs":"https://docs.lucee.org/reference/functions/decodefromurl.html"},
		"railo": {"minimum_version":"", "notes":"", "docs":"http://railodocs.org/index.cfm/function/DecodeFromURL"},
		"boxlang": {"minimum_version":"1.0.0", "notes":"Requires the `bx-esapi` module", "docs":"https://boxlang.ortusbooks.com/boxlang-framework/modularity/esapi"},
		"rustcfml": {"minimum_version": ""}
	},
	"links": [],
	"examples": [
		{
			"title": "Tag Syntax",
			"description": "",
			"code": "<cfset string = 'http://www.adobe.com/'> \r\n<cfset urlencoded = encodeForURL(string)>\r\n<cfset urldecoded = decodeFromURL(urlEncoded)>\r\n <cfoutput>\r\nString: #string#<br/>\r\nURL Encoded: #urlencoded#<br/>\r\nURL Decoded: #urldecoded#<br/>\r\n</cfoutput>\r\n",
			"result": ""
		}
	]
}
