{
	"name": "soundEx",
	"type": "function",
	"syntax": "soundEx(str)",
	"returns": "string",
	"related": ["metaphone"],
	"description": "Soundex is a phonetic algorithm for indexing names by sound, as pronounced in English.\nThe goal is for homophones to be encoded to the same representation so that they can be matched despite minor differences in spelling.\nThe algorithm mainly encodes consonants; a vowel will not be encoded unless it is the first letter.\n\nSoundex is the most widely known of all phonetic algorithms, as it is a standard feature of MS SQL and Oracle, and is often used (incorrectly) as a synonym for 'phonetic algorithm'",
	"params": [
		{"name": "str", "description": "", "required": true, "default": "", "type": "string", "values": []}
	],
	"engines": {
		"lucee": {"minimum_version": "", "notes": "", "docs": "https://docs.lucee.org/reference/functions/soundex.html"},
		"rustcfml": {"minimum_version": ""}
	},
	"links": [],
	"examples": [{
		"title":"Get Soundexes of \"Robert\", \"Rupert\" and \"Rubin\"",
		"description":"Both \"Robert\" and \"Rupert\" return the same string \"R163\" while \"Rubin\" yields \"R150\"",
		"code":"soundEx(\"Robert\")&\"/\"&soundEx(\"Rupert\")&\"/\"&soundEx(\"Rubin\")",
		"result":"R163/R163/R150",
		"runnable": true
	}]
}
