{
	"name": "imageFilterCurves",
	"type": "function",
	"syntax": "imageFilterCurves()",
	"returns": "any",
	"related": ["imageFilterColorMap","imageFilter","imageFilterKernel","imageFilterWarpGrid"],
	"description": "",
	"params": [],
	"engines": {
		"lucee": {"minimum_version": "", "notes": "", "docs": "https://docs.lucee.org/reference/functions/imagefiltercurves.html"}
	},
	"examples": [],
	"links": []
}
