{
	"name":"arrayResize",
	"type":"function",
	"syntax":"arrayResize(array, size)",
	"member":"someArray.resize(size)",
	"returns":"boolean",
	"related":[],
	"description":"Resets an array to a specified minimum number of elements.\n This can improve performance, if used to size an array to its\n expected maximum. For more than 500 elements, use arrayResize\n immediately after using the ArrayNew tag.",
	"params": [
		{"name":"array","description":"","required":true,"default":"","type":"array","values":[]},
		{"name":"size","description":"","required":true,"default":"","type":"numeric","values":[]}
	],
	"engines": {
		"coldfusion": {"minimum_version":"3", "notes":"", "docs":"https://helpx.adobe.com/coldfusion/cfml-reference/coldfusion-functions/functions-a-b/arrayresize.html"},
		"lucee": {"minimum_version":"", "notes":"", "docs":"https://docs.lucee.org/reference/functions/arrayresize.html"},
		"openbd": {"minimum_version":"", "notes":"", "docs":"http://openbd.org/manual/?/function/arrayresize"},
		"boxlang": {"minimum_version":"1.0.0", "notes":"", "docs":"https://boxlang.ortusbooks.com/boxlang-language/reference/built-in-functions/array/arrayresize"},
		"rustcfml": {"minimum_version": ""}
	},
	"links": [
		{
		"title":"Learning Built-In Functions And Member-Methods by Ben Nadel",
		"description":"",
		"url":"https://www.bennadel.com/blog/3813-built-in-functions-and-member-methods-return-different-data-types-in-lucee-cfml-5-3-5-92.htm"
		}
	],
	"examples": [
		{
			"title": "Tag Syntax",
			"description": "",
			"code": "<cfset MyArray = arrayNew(1)> \r\n <!--- Resize that array to the number of records in the query. ---> \r\n <cfset temp = arrayResize(MyArray, 8)> \r\n  <cfdump var=\"#MyArray#\" />  ",
			"result": ""
		}
	]

}
