{
	"name":"sessionGetMetadata",
	"type":"function",
	"syntax":"sessionGetMetadata();",
	"returns":"struct",
	"related":[],
	"description":" Returns meta data related to the current session.",
	"params": [
		{"name":"region","description":"Name of the cache region.","required":true,"default":"","type":"string","values":[]}
	],
	"engines": {
		"coldfusion": {"minimum_version":"10", "notes":"", "docs":"https://helpx.adobe.com/coldfusion/cfml-reference/coldfusion-functions/functions-s/sessiongetmetadata.html"},
		"rustcfml": {"minimum_version": ""}
	},
	"links": [

	],
	"examples": [
		{
			"title": "Tag Syntax",
			"description": "",
			"code": "<cfset metaData = sessionGetMetadata() > \r\n",
			"result": ""
		}
	]

}