{
	"name":"ormReload",
	"type":"function",
	"syntax":"ormReload()",
	"returns":"void",
	"related":[],
	"description":"Reinitializes ORM for the application.If you make any change to the persistent metadata of the CFCs, then you might want to reload the ORM.  Returns ORM session factory instance",
	"params": [
	],
	"engines": {
		"coldfusion": {"minimum_version":"", "notes":"", "docs":"https://helpx.adobe.com/coldfusion/cfml-reference/coldfusion-functions/functions-m-r/ormreload.html"},
		"lucee": {"minimum_version":"", "notes":"", "docs":"https://docs.lucee.org/reference/functions/ormreload.html"},
		"railo": {"minimum_version":"", "notes":"", "docs":"http://railodocs.org/index.cfm/function/ormreload"}
	},
	"links": [

	],
	"examples": [
		{
			"title": "Reload ORM by calling ormReload onRequestStart",
			"description": "Reloads the ORM of an application when ?ORMReload is in the URL.  This is recommeded ONLY for development and should be removed from production.",
			"code": "component { \r\n\tthis.name = hash(getCurrentTemplatePath()); \r\n\tthis.datasource = \"somedatasourceORM\"; \r\n\t// turn on ORM for this application\r\n\tthis.ormenabled = true; \r\n\tpublic boolean function onRequestStart(required string targetPage) {\r\n\t\t//if ormreload is in the URL, then reload ORM\r\n\t\tif (structKeyExists(url,\"ormreload\")){\r\n\t\t\tORMReload()\r\n\t\t}\r\n\t\treturn true;\r\n\t}\r\n}",
			"result": "string"
		}
	]
}
