{
	"name":"spreadsheetGetCellHyperlink",
	"type":"function",
	"syntax":"spreadsheetGetCellHyperlink(spreadsheetObj, row, column)",
	"returns":"string",
	"related":["spreadsheetSetCellHyperlink","spreadsheetGetCellValue","spreadsheetNew"],
	"description":" Returns the URL of the hyperlink attached to a cell in the active sheet of a spreadsheet workbook, or an empty string if the cell has no hyperlink. Rows and columns are 1-based. The fluent member form is getCellHyperlink(row, column).",
	"params": [
		{"name":"spreadsheetObj","description":"The spreadsheet workbook object.","required":true,"default":"","type":"any","values":[]},
		{"name":"row","description":"1-based row index of the cell.","required":true,"default":"","type":"numeric","values":[]},
		{"name":"column","description":"1-based column index of the cell.","required":true,"default":"","type":"numeric","values":[]}
	],
	"engines": {
		"rustcfml": {"minimum_version": "", "notes": "Not supported on wasm32."}
	},
	"links": [

	],
	"examples": [
		{
			"title":"Read a hyperlink back",
			"description":"Set a hyperlink on B2 and read its URL back.",
			"code":"wb = Spreadsheet(\"xlsx\");\r\nspreadsheetSetCellHyperlink(wb, \"https://example.com\", 2, 2, \"Open link\");\r\nwriteDump(spreadsheetGetCellHyperlink(wb, 2, 2));",
			"result":"https://example.com",
			"runnable":true
		}
	]

}
